,ID,Tweet,Timestamp,Likes,Retweets,Length
963,1578747272489504771,مرحبا خره اطلب عندكم مكتوب ١٠ طلبات توصيل مجانا بعدين طلعلي الاوصيل ب٢٥ ليش,2022-10-08 14:00:56+00:00,0,0,114
964,1578747000928903170,الرد,2022-10-08 13:59:51+00:00,0,0,22
965,1578746913150537728,كلمت محد حولي,2022-10-08 13:59:30+00:00,0,0,28
966,1578746629607546881,الدقيقة ٣٢ يوصل أسرع شيء,2022-10-08 13:58:22+00:00,0,0,95
967,1578746234537644037,اسوأ خدمة عملاء رفعت شكوتي وبعد اسبوع جاني الرد وعلى شي المتفق مانزل المبلغ حسابي ورجعت رفعت شكوى ثانيه بدون رد عطوني رقم للتواصل,2022-10-08 13:56:48+00:00,2,0,172
968,1578746176438161408,بانتظاركم نشوف المهزلة مندوبيكم تحل المشكلة رفع ارفع دعوة شركتكم لاني ناعرف المندوب اعرف شركتكم,2022-10-08 13:56:34+00:00,0,0,133
969,1578745580196503552,علما اعطوني تعويض نصف قيمة مبلغ الطلب والنص تحملته واكله السواق حقكم جعله مايحدر بطنه وكاني طالب يتغدا حسابي,2022-10-08 13:54:12+00:00,0,0,148
970,1578745384486113280,927524424,2022-10-08 13:53:25+00:00,0,0,24
971,1578744528973967360,مستر مندوب هنقرستيشن مرسول جاهز 90709,2022-10-08 13:50:02+00:00,1,0,82
972,1578744509739204609,هنقرستيشن فزع اسررررع شي دقيقة الثانيه ٣٢ 02,2022-10-08 13:49:57+00:00,0,0,101
973,1578744433742295040,مستر مندوب هنقرستيشن مرسول جاهز 57,2022-10-08 13:49:39+00:00,1,0,82
974,1578743360059101184,32 رهيب المقطع,2022-10-08 13:45:23+00:00,0,0,81
975,1578743066378522626,مستر مندوب هنقرستيشن مرسول جاهز 95,2022-10-08 13:44:13+00:00,3,0,82
976,1578742921570185219,مستر مندوب هنقرستيشن مرسول جاهز 025,2022-10-08 13:43:38+00:00,2,0,82
977,1578742899159994369,تسحييييييييب تسحييييب,2022-10-08 13:43:33+00:00,0,0,68
978,1578742891790274560,مستر مندوب هنقرستيشن مرسول جاهز 99,2022-10-08 13:43:31+00:00,2,0,82
979,1578742865764589568,تسحييييييييب,2022-10-08 13:43:25+00:00,0,0,59
980,1578742807530942464,مستر مندوب هنقرستيشن مرسول جاهز 44,2022-10-08 13:43:11+00:00,1,0,82
981,1578742783871160321,لعبه تسحيب هنقرستيشن فوزونا ترى نحبكم,2022-10-08 13:43:05+00:00,0,0,105
982,1578742730762571776,احلى تسحيب منمونة يارب الفوز,2022-10-08 13:42:53+00:00,0,0,68
983,1578742670494531584,مستر مندوب هنقرستيشن مرسول جاهز 46,2022-10-08 13:42:38+00:00,1,0,82
984,1578741939352264704,سويت طلب تطبيقكم 28 وسواقكم نصاب رقم وهمي مغلق مايرد الرسايل بالتطبيق وتواصلت الدعم الفني استفيد والسواق وصل للحي الي ساكن وسوا تسليم الطلب وانا ماستلمته والكاميرات تشهد وانتم تراصلت معكم خاص يتم الرد وبيتم رفع دعوى,2022-10-08 13:39:44+00:00,1,0,276
985,1578741180850110464,مستر مندوب هنقرستيشن مرسول جاهز 052 65,2022-10-08 13:36:43+00:00,1,0,82
986,1578740905020116994,مستر مندوب هنقرستيشن مرسول جاهز 14,2022-10-08 13:35:38+00:00,1,0,82
987,1578738750116745217,جميعآ تقريبآ شهر ونص طلبت هنقرستيشن الطلب 58 جاني الطلب ناقص وغلط موب اللي طالبه تواصلت معهم وقالو ماراح يتكرر مره ثانيه تفاجآت انهم قفلو حسابي حظر ابي افهم بناكل فلوسك نقفل حسابك علامات استفهام كثيره ياهنقرستيشن,2022-10-08 13:27:04+00:00,0,0,293
988,1578738591920160770,مستر مندوب هنقرستيشن مرسول جاهز 462,2022-10-08 13:26:26+00:00,1,0,77
989,1578737864174542849,مستر مندوب هنقرستيشن مرسول جاهز 428,2022-10-08 13:23:33+00:00,1,0,77
990,1578737424582160384,مستر مندوب هنقرستيشن مرسول جاهز 05011,2022-10-08 13:21:48+00:00,1,0,77
991,1578737293103284225,تطبيق سيء مايردون شي وفوقها طلبات ناقصه وخاطئه واذا تكلمت يقفلون حسابك نهائي,2022-10-08 13:21:16+00:00,0,0,100
992,1578737248354578432,99,2022-10-08 13:21:06+00:00,0,0,43
993,1578736554733772800,دايما مميزين شي,2022-10-08 13:18:20+00:00,0,0,39
994,1578735671279513600,شكر ماتقصرون انتظركم,2022-10-08 13:14:50+00:00,1,0,40
995,1578735169074143232,بالانتظار,2022-10-08 13:12:50+00:00,0,0,24
996,1578735143619264512,مستر مندوب هنقرستيشن مرسول جاهز 38,2022-10-08 13:12:44+00:00,1,0,77
997,1578734980385370113,سمحتم تواصلت موظف بخدمة العملاء جميعهم يقفلون المحادثه يفيديوني اتمنى تتواصلون معي وتشوفون حل للمشكله,2022-10-08 13:12:05+00:00,0,0,140
998,1578734967076442112,وانتم قيد المتابعه,2022-10-08 13:12:02+00:00,0,0,44
999,1578734851108503552,اقعدوا شوي زيدوا واقعدوا وظفوا اهم شيء تاخذون فلوس يهم خدمة العميل,2022-10-08 13:11:34+00:00,0,0,127
1000,1578734823216099330,مستر مندوب هنقرستيشن مرسول جاهز 585,2022-10-08 13:11:27+00:00,1,0,77
1001,1578734724066856960,مستر مندوب هنقرستيشن مرسول جاهز 968,2022-10-08 13:11:04+00:00,1,0,77
1002,1578734552985399299,ليش الايس وايت موكا اغلب المشروبات مو موجودين هنقرستيشن,2022-10-08 13:10:23+00:00,0,0,90
1003,1578734427940982784,هنقرستيشن مرسول 972,2022-10-08 13:09:53+00:00,0,0,171
1004,1578734408026427393,33 رب,2022-10-08 13:09:48+00:00,0,0,25
1005,1578734391362084864,579356103 رقم الطلب,2022-10-08 13:09:45+00:00,0,0,39
1006,1578734184436072449,مستر مندوب هنقرستيشن مرسول جاهز 487,2022-10-08 13:08:55+00:00,1,0,82
1007,1578733639256264705,عروض جميله,2022-10-08 13:06:45+00:00,0,0,25
1008,1578733558755385344,مطعم سموكد اوت باربكيو اسوأ شي تاكلونه بحياتكم تطبيق هنقرستيشن شوفو شكل الطلب بالتطبيق وبعد ماوصل يقول الطعم الحقيقي لبرجر لحم الانجوس شكر 785,2022-10-08 13:06:26+00:00,2,0,200
1009,1578732814047989760,مستر مندوب هنقرستيشن مرسول جاهز 26,2022-10-08 13:03:28+00:00,1,0,82
1010,1578732624381497345,مستر مندوب هنقرستيشن مرسول جاهز 23,2022-10-08 13:02:43+00:00,1,0,82
1011,1578732560573612032,ساعه يلف الاحياء كلها وللحين جاء طلبي انتظر بكره 297,2022-10-08 13:02:28+00:00,2,0,101
1012,1578732375634509824,مستر مندوب هنقرستيشن مرسول جاهز 66,2022-10-08 13:01:44+00:00,1,0,82
1013,1578732311297740800,مستر مندوب هنقرستيشن مرسول جاهز 53506,2022-10-08 13:01:29+00:00,1,0,82
1014,1578732080158380033,كذابين وحراميه وهم يتهربون,2022-10-08 13:00:33+00:00,0,0,118
1015,1578732012130951169,مستر مندوب هنقرستيشن مرسول جاهز 19,2022-10-08 13:00:17+00:00,1,0,82
1016,1578731844434296833,كذابين وحراميه وهم يتهربون 57,2022-10-08 12:59:37+00:00,0,0,108
1017,1578731842064515073,مستر مندوب هنقرستيشن مرسول جاهز 686,2022-10-08 12:59:37+00:00,1,0,82
1018,1578731670022557696,كذابين وحراميه وهم يتهربون 97,2022-10-08 12:58:56+00:00,0,0,108
1019,1578731605069557761,4919,2022-10-08 12:58:40+00:00,0,0,68
1020,1578731435602870272,مابي ٥٠٠ ابي ال ٥١ حقتي نصابين,2022-10-08 12:58:00+00:00,0,0,57
1021,1578731362043170817,ابغا افهم ليش ماتردون ومركز المساعده مايردون,2022-10-08 12:57:42+00:00,0,0,64
1022,1578731220245962752,ارجو الرد خاص للضروره القصوى,2022-10-08 12:57:08+00:00,0,0,43
1023,1578731195759702016,وانتم بخير 222 مرسول جاهز هنقرستيشن,2022-10-08 12:57:03+00:00,0,0,89
1024,1578731168282775552,للاسف صاير اسوء تطبيق للتوصيل كميةاستغلال للعميل,2022-10-08 12:56:56+00:00,0,0,68
1025,1578731082799009793,الدقيقة بالتحديد ٣٢,2022-10-08 12:56:36+00:00,0,0,49
1026,1578730668976091136,مستر مندوب هنقرستيشن مرسول جاهز 56,2022-10-08 12:54:57+00:00,1,0,82
1027,1578730564072673283,مستر مندوب هنقرستيشن مرسول جاهز 811,2022-10-08 12:54:32+00:00,2,0,82
1028,1578730542496825344,متواصله معاهم رد رجعوا المبلغ عوضوني اكل,2022-10-08 12:54:27+00:00,1,0,87
1029,1578730503510728704,1026333262,2022-10-08 12:54:18+00:00,1,0,25
1030,1578730259117051905,مسترمندوب 222 مرسول جاهز هنقرستيشن 467,2022-10-08 12:53:19+00:00,0,0,83
1031,1578729466486231041,وانتم بخير مسترمندوب مرسول جاهز هنقرستيشن 6764,2022-10-08 12:50:10+00:00,0,0,154
1032,1578729125967077377,مسترمندوب 222 مرسول جاهز هنقرستيشن,2022-10-08 12:48:49+00:00,0,0,69
1033,1578727092836962305,وصلني الطلب منظر السائق والسيارة كأنه مقاول بصراحة شي مقزز,2022-10-08 12:40:44+00:00,0,0,79
1034,1578727052358090753,538559078,2022-10-08 12:40:35+00:00,0,0,24
1035,1578726675587952642,وانتم بخير مسترمندوب مرسول جاهز هنقرستيشن 629,2022-10-08 12:39:05+00:00,5,5,89
1036,1578726407085383680,رقم الطلب,2022-10-08 12:38:01+00:00,0,0,54
1037,1578726039617908736,اتفق والله هنقرستيشن اعلاناتهم الجديدة تفووزز,2022-10-08 12:36:33+00:00,1,0,55
1038,1578725932579553284,تعامل خدمة العملاء جد سيء اوضح شي بالتفصيل لقيت نتيجه,2022-10-08 12:36:08+00:00,0,0,85
1039,1578725776513323008,726812528,2022-10-08 12:35:31+00:00,0,0,24
1040,1578723871389233152,هنقرستيشن مرسول 955,2022-10-08 12:27:56+00:00,1,0,171
1041,1578723359877398529,فيك خير مزرعة بقل بصائر الأخير شيخ يجلس يعني البقل,2022-10-08 12:25:54+00:00,0,0,93
1042,1578721757208268800,اسبوع اكلمكم الخاص العام اقولكم شوفو الخاص وبدون رددد نهائيا احترام للعميل,2022-10-08 12:19:32+00:00,0,0,145
1043,1578721732831375360,مرحبا طلبت طلبي ووصلني ناااااااقص واتواصل الدعم ويرجعون مبلغ التوصيل فقط بالمحفظه وانا موضح ماوصلني شيء والمبلغ اللي انسحب مني,2022-10-08 12:19:26+00:00,1,0,159
1044,1578721413338308609,32 548,2022-10-08 12:18:10+00:00,0,0,54
1045,1578721182358331392,طلبت ستار بكس ووصلتني المشروبات مضاف سكر تواصلت خدمة العملاء والرد نعتذر مارح يتكرر الخطأ بالمستقبل احتاج حل لطلبي الحالي,2022-10-08 12:17:15+00:00,1,1,160
1046,1578720918775681025,اتواصلت عشره تقريبا بخصوص طلبي يصل يتم تعويضي عنه مارجعتو فلوسي سيتم رفع شكوى لوزاره التجاره,2022-10-08 12:16:12+00:00,0,0,158
1047,1578720214619148289,شوف مناديب ططهنجر بالشارع ينتظرون 33,2022-10-08 12:13:25+00:00,0,0,76
1048,1578719346679222272,ثانية 32 الدقيقة,2022-10-08 12:09:58+00:00,0,0,33
1049,1578719234019860480,الطلب الساعه المسافه المنزل وهرفي المقدر للوصل 54 05 مدة التوصيل ساعه ليه طالب مفطح 512,2022-10-08 12:09:31+00:00,0,0,167
1050,1578719220061581312,وانتم بخير مستر مندوب مرسول جاهز هنقرستيشن 17,2022-10-08 12:09:27+00:00,0,0,156
1051,1578718798332383232,33 مرسول جاهز هنقرستيشن 75,2022-10-08 12:07:47+00:00,0,0,93
1052,1578718053449498625,وانتم بخير مرسول جاهز هنقرستيشن,2022-10-08 12:04:49+00:00,2,2,96
1053,1578716872375033864,احتراااف بالتسحييب,2022-10-08 12:00:08+00:00,0,0,83
1054,1578716721820536832,الدقيقة بالتحديد ٣٢ يارب افوز يارب 27,2022-10-08 11:59:32+00:00,0,0,109
1055,1578716220056285185,بارك الله فيك بعطيك نصيبك فزت,2022-10-08 11:57:32+00:00,0,0,62
1056,1578715996466315264,خالد لعبه تسحيب,2022-10-08 11:56:39+00:00,0,0,67
1057,1578715982683844610,الفنان حقنا 382,2022-10-08 11:56:36+00:00,0,0,76
1058,1578715611425026048,الدقيقة الأولى 32 اخضرنااااا وهنقرستيشنناااا يارب توفيقك هنقرستيشن 976,2022-10-08 11:55:07+00:00,0,0,130
1059,1578715410685661189,الدقيقة الأولى 32 يارب توفيقك هنقرستيشن 976,2022-10-08 11:54:19+00:00,0,0,104
1060,1578715115272404995,الدقيقة الأولى 32 يارب توفيقك هنقرستيشن 110,2022-10-08 11:53:09+00:00,0,0,110
1061,1578713046318399489,متأكد الشروط,2022-10-08 11:44:55+00:00,0,0,31
1062,1578713026269564928,جرب تطبيق مستر مندوب وراح يعجبك اكيد,2022-10-08 11:44:51+00:00,0,0,90
1063,1578712543517818881,جرب تطبيق مستر مندوب وراح يعجبك اكيد 47,2022-10-08 11:42:56+00:00,0,0,91
1064,1578712403671650304,جرب تطبيق مستر مندوب وراح يعجبك اكيد 26,2022-10-08 11:42:22+00:00,0,0,95
1065,1578712380996919297,لحظة بدك تزيد دخلك وتصير مندوب أسرع دعم حل مشاكل المناديب سجل بياناتك الرابط وبنفعل حسابك 91 الواتساب 966 53 395 7250 سناب شات 39208 تيك توك,2022-10-08 11:42:17+00:00,0,0,288
1066,1578712155964452870,جرب تطبيق مستر مندوب وراح يعجبك اكيد 4739,2022-10-08 11:41:23+00:00,0,0,87
1067,1578712082400149504,جرب تطبيق مستر مندوب وراح يعجبك اكيد 25,2022-10-08 11:41:06+00:00,0,0,87
1068,1578712030940262400,ارجوا الرد عبر الخاص,2022-10-08 11:40:53+00:00,2,0,35
1069,1578712012091437059,جرب تطبيق مستر مندوب وراح يعجبك اكيد 095,2022-10-08 11:40:49+00:00,0,0,90
1070,1578711921783865344,جرب تطبيق مستر مندوب وراح يعجبك اكيد 33,2022-10-08 11:40:27+00:00,0,0,87
1071,1578711247515975681,طلبي تأخر جدا علي يعني مو فاهم اوقات ذروة ولاشيء 287,2022-10-08 11:37:47+00:00,1,0,90
1072,1578710336450203649,مسترمندوب 222 مرسول جاهز هنقرستيشن عشاق البيتزا,2022-10-08 11:34:09+00:00,1,0,93
1073,1578708365261185024,الثلاثاء طلبت عندكم ستاربكس قعدت استنى الطلب الساعة وربع وقت التوصيل ٤٠ ٥٠ دقيقة بعدها وصل الطلب خطأ طلبت قهوة باردة ووصلتني قهوة حارة حسابي ٣٤ والطلب اللي وصلني ٣٢ تواصلت الدعم الفاضي الثلاثاء مافي رد وبعدين,2022-10-08 11:26:19+00:00,2,0,277
1074,1578708322290569216,مستر مندوب 222 هنقرستيشن مرسول جاهز عشاق البيتزا 556,2022-10-08 11:26:09+00:00,0,0,101
1075,1578707481131646977,مسترمندوب 222 مرسول جاهز هنقرستيشن 069,2022-10-08 11:22:49+00:00,0,0,73
1076,1578707415402708993,للاسف التواصل يوجد حل منكم شكرا لعدم احترامكم لعملاءكم,2022-10-08 11:22:33+00:00,2,0,124
1077,1578705332364513280,يشتغل عندي وحطيت دفع الكتروني,2022-10-08 11:14:16+00:00,1,0,71
1078,1578704776032051202,ميلان,2022-10-08 11:12:04+00:00,0,0,100
1079,1578703211879616517,اربع منتجات بقيمة 199 عرض رد الزيارة بقلاوة ريڤال 30 قطعة كروكان بثلاث حشوات فستق تشيز كيك رهش 18 حبة بوكس ساندويش 20 حبة موالح نص كيلو 30,2022-10-08 11:05:51+00:00,5,3,234
1080,1578702781825024000,كنا ناوين نسوي مفاجأه للمديرة ونعزمها وصديقاتي المعلمات الأحد باذن الله ونطلب تطبيق جاهز هنقرستيشن وانصدمت انكم مو شغالين بالحي حقنا حرررام ليش أتمنى تفتحونه بالتطبيق بالقريب العاجل 832,2022-10-08 11:04:08+00:00,0,0,240
1081,1578702078972940289,نفووووز معكم شوفوا حسااابي تقريبا اقدم يشارك اخترتوه اهيء اهيء اهيء,2022-10-08 11:01:21+00:00,0,0,129
1082,1578701887989493760,اجمع شيء بـ وقت صحة وخفة ولذاااذة,2022-10-08 11:00:35+00:00,0,0,220
1083,1578701235607457793,يارب الدقيقه فزع,2022-10-08 10:58:00+00:00,0,0,42
1084,1578700881200967682,اعلان يشجع التجاوزات الخاطئة والسرعه وعدم اعطاء الطريق حقه,2022-10-08 10:56:35+00:00,0,0,80
1085,1578700293021106176,طيب حسابي الي حظروه,2022-10-08 10:54:15+00:00,0,0,38
1086,1578699851038326785,اتواصلت ومافي أرسل ايميل شي,2022-10-08 10:52:29+00:00,0,0,59
1087,1578698970376728576,يارب تجعل نصي هنقرستيشن فزع اسررررع شي دقيقة الثانيه ٣٢,2022-10-08 10:49:00+00:00,0,0,110
1088,1578698563705413632,طرقة تسجيل الدخول كسائق,2022-10-08 10:47:23+00:00,0,0,43
1089,1578698468574769153,حلووو,2022-10-08 10:47:00+00:00,0,0,22
1090,1578696569704001536,وانتم بخير مسترمندوب مرسول جاهز هنقرستيشن 35,2022-10-08 10:39:27+00:00,12,2,115
1091,1578696463240269824,وين خدمة العملاء حقتكم ساعة طالبة ومندوبكم يدور المطاعم ياخذ طلبات طلبت عشان يوصلني اكلي متأخر وبارد خير شاء الله,2022-10-08 10:39:02+00:00,2,0,163
1092,1578696358462386180,ههههههههههههههههههههههه والله,2022-10-08 10:38:37+00:00,0,0,69
1093,1578695479730192385,بالدقيقة اسرع شي بالضبط بالثانية 32 يااارب افوووز,2022-10-08 10:35:07+00:00,0,0,95
1094,1578695100288618501,طلبت تواصل معاي المندوب جاني الطلب أرسلكم يرد علي,2022-10-08 10:33:37+00:00,2,0,91
1095,1578695051487883264,وانتم بخير مسترمندوب مرسول جاهز هنقرستيشن 61,2022-10-08 10:33:25+00:00,5,5,89
1096,1578695032646688768,واذا وصلني كلمة مرور وحطيته يطلع فشل,2022-10-08 10:33:21+00:00,0,0,54
1097,1578695017400782850,هنقر ستيشن فزع لأخضرنا دقيقة ال٣٢ ثانية تطبيق بطل,2022-10-08 10:33:17+00:00,0,0,77
1098,1578693871688876032,شاركتي,2022-10-08 10:28:44+00:00,0,0,32
1099,1578692910320844801,جابو الطلب وانا طالبه غيير وحق طلبي ١٤٤ واخرتها بشتكي قفلو حسابي ليش 30,2022-10-08 10:24:55+00:00,1,0,131
1100,1578692724475121664,سمحتو المندوب ينتظر الدفع وتظبيقهكم معلق,2022-10-08 10:24:10+00:00,1,0,58
1101,1578692534217637888,هنقرستيشن يزودون السعر المطاعم افضلك تطلب تطبيق البيك,2022-10-08 10:23:25+00:00,0,0,85
1102,1578692452588097536,الوقوع حب حنون نجاة هنقرستيشن 442,2022-10-08 10:23:06+00:00,0,0,65
1103,1578690864586817537,بقفل الحساب وبكون المشتركين الي بيشتركون تعالو بسرعه ومعك بطاقتك هنقرستيشن 100,2022-10-08 10:16:47+00:00,4,1,105
1104,1578690532611530752,وش شوي تزودوا وقت وصول الطلب طالب ساعة12 ونص وكمان ماتقدر تلغي الطلب ليش هالتمطيل 99,2022-10-08 10:15:28+00:00,4,0,135
1105,1578689930905415684,الدقيقة الأولى 33,2022-10-08 10:13:04+00:00,0,0,40
1106,1578689733097840642,وانتم بخير مسترمندوب مرسول جاهز هنقرستيشن 413,2022-10-08 10:12:17+00:00,1,0,89
1107,1578689528201478144,مستر مندوب هنقرستيشن مرسول جاهز عشاق السمك,2022-10-08 10:11:28+00:00,1,0,94
1108,1578688248725254144,تقدر تلغي الطلب لسه المطعم ماقبل الطلب,2022-10-08 10:06:23+00:00,0,0,74
1109,1578687990570029058,بعرف ليش توقفون حسابي ميلغ ووقفتوه عشان انو رفعت شكوى لطلبي جاني طلب مو طلبي والطلب ينوكل وغير مغلف باحكام ماعرف المشكله المطعم المندوب وفوق وقفتو حسابي,2022-10-08 10:05:22+00:00,0,0,189
1110,1578687894922764288,يعقل السائق يضع الطلب المقعده الاماميه ومشغل المكيف اين حقيبة حفظ الحراره 819,2022-10-08 10:04:59+00:00,2,0,132
1111,1578687841143762944,محد يرد رجعتو فلوسي,2022-10-08 10:04:46+00:00,0,0,38
1112,1578686321224474624,ارسلتلكم الخاص,2022-10-08 09:58:44+00:00,0,0,31
1113,1578686018815164416,سؤال لمحبي تأكل,2022-10-08 09:57:32+00:00,0,1,75
1114,1578684883131858945,متفقين مره يختار,2022-10-08 09:53:01+00:00,0,0,42
1115,1578684549743407105,مايفتح معي التطبيق ويطلا عندي فشل,2022-10-08 09:51:41+00:00,0,0,52
1116,1578683621640384517,طلبت طلب وجاني طلب الي طلبته وللاسف موظفين الدعم الفني لديكم لايوجد لديهم ذره احترافيه واستهزاء بالعميل اطالب بارجعاع مبلغ الطلب وتعويضي وموظفينكم يقولون نعتذر منك مانقدر نخدمك,2022-10-08 09:48:00+00:00,2,0,218
1117,1578683576849027074,لعبها بالمختصر تسحيب,2022-10-08 09:47:49+00:00,1,0,117
1118,1578682726269739008,الدقيقه الثانيه 32 يارب توفيقك هنقر ستيشن,2022-10-08 09:44:27+00:00,0,0,80
1119,1578682482010259458,مرسول جاهز هنقرستيشن 721,2022-10-08 09:43:28+00:00,1,1,93
1120,1578682034868072450,خاص ربي يوسع علينا وعليكم,2022-10-08 09:41:42+00:00,0,0,64
1121,1578681714083516416,ليش زيادة بالطلب ٣٨ فرق الفاتورتين لاطشين مني ٣٨,2022-10-08 09:40:25+00:00,3,0,106
1122,1578679966174060546,حلو صبرتو شوي ليه العجله مرسل لدعم ولكم ردكم بخمس ساعات,2022-10-08 09:33:29+00:00,0,0,90
1123,1578679893617160193,مستخدمه جديده التطبيق حسبتو طلبات توصيل مجاني المفترض باقي باد جالس يطلب رسوم توصيل,2022-10-08 09:33:11+00:00,1,0,136
1124,1578679130685509633,مافيه كفو هنقرستيشن هوه اللي يفرق معي أطلق تطبيق توصيل 379,2022-10-08 09:30:09+00:00,1,0,93
1125,1578679120946659330,هنقرستيشن فزع اسررررع شي دقيقة الثانيه ٣٢ 679,2022-10-08 09:30:07+00:00,0,0,103
1126,1578679086154907649,هنقرستيشن فزع اسررررع شي دقيقة الثانيه ٣٢ 00,2022-10-08 09:29:59+00:00,0,0,103
1127,1578678931242160129,وصلت الرسالة ٣٢ وصلوا للأخضر ٥٢ اقووووى فزعه ياحلوككم,2022-10-08 09:29:22+00:00,0,0,104
1128,1578678820177338369,هنقرستيشن فزع اسررررع شي دقيقة الثانيه ٣٢ 54,2022-10-08 09:28:55+00:00,0,0,103
1129,1578678772210929664,هنقرستيشن فزع اسررررع شي دقيقة الثانيه ٣٢ 52,2022-10-08 09:28:44+00:00,0,0,103
1130,1578678688971100160,هنقرستيشن فزع اسررررع شي دقيقة الثانيه ٣٢ 4187,2022-10-08 09:28:24+00:00,0,0,103
1131,1578676623871647744,الثانيه 54,2022-10-08 09:20:12+00:00,0,0,25
1132,1578676193024528384,حي اك الله بإمكانك التواصل إدارة هنقرستيشن حال التجاوب قبلهم الجهة الرقابية تطبيقات التوصيل الهيئة العامة للنقل عبر الرقم الموحد 19929 سعدنا بخدمتك,2022-10-08 09:18:29+00:00,0,0,201
1133,1578675328964505601,بالطيب الغالي اسعارنا تطبيقات التوصيل تختلف الاسعار تطبيقنا حمل تطبيقنا,2022-10-08 09:15:03+00:00,0,0,145
1134,1578674737953538049,للحين مافي خدمة تذكر تأخير واكل بارد نقص الطلبات تستلم طلب مو,2022-10-08 09:12:42+00:00,3,0,94
1135,1578673848324849665,شوفوا حل منادييب التوصيل بالأمس مندوب التوصيل اللغى طلبي,2022-10-08 09:09:10+00:00,2,0,79
1136,1578672219873374208,وانتم بخير مسترمندوب 33 مرسول جاهز هنقرستيشن 647,2022-10-08 09:02:42+00:00,0,0,88
1137,1578671826519019520,ارسله خاص,2022-10-08 09:01:08+00:00,0,0,24
1138,1578671767924928513,العكس بطلع والله طول 25 دقيقه عندك وشركه عالميه يعني ميحتاج,2022-10-08 09:00:54+00:00,0,0,107
1139,1578671185063464961,سلموا مايجبرك تشتري 35 علشان يوصلك الطلب ب9 التخفيض عندهم بدون شرط وفيه مطاعم ضايفه عندها خصم 20 برضه بدون شرط ولاعمري عانيت منهم الغلا فاحش للامانه,2022-10-08 08:58:35+00:00,1,1,206
1140,1578669912079601664,يناس لاحد يطلب منهم وسخين يوصلك الاكل بحاله جيده يردون 65,2022-10-08 08:53:31+00:00,0,0,101
1141,1578669057104306176,رسلت ايميلين ورسلت الخاص معقوله مافي تجاوب منكم,2022-10-08 08:50:08+00:00,3,0,74
